IsiLaporan,IsiLaporan Setelah Preprocessing,kategori
Pak saya mau ngasih tau tentang JPO di deket simpang lima depan Bank Danamon itu JPO nya ada yang masih ketutup yang sebelah utara jadi orang yang mau menyebrang dari arah selatan tidak bisa keluar,ngasih jpo deket simpang lima bank danamon jpo nya tutup belah utara orang menyebrang arah selatan,8
Bang ridwan.dinas di jajaran pemkot.paling kebocoran anggaran(mcm2 pajak/uang rakyat)adlah binamarga pu.krna pekerjaan proyek2.drainage.trotoar.jalan tdk ada yg bagus kwalitas.sebentar2.batu andesit copot.got penuh tanah/sampah.jalan masih banyak bolong,bang ridwan dinas jajar pemkot bocor anggar mcm pajak uang rakyat adlah binamarga pu krna kerja proyek drainage trotoar jalan bagus kwalitas sebentar batu andesit copot got penuh tanah sampah jalan bolong,8
Aslmalikm....met pagi pabu knapa bntuan untuk anak saya yng mdptkn krt kps nyampe sekarang belum menerima atasnama arip ramdani sd tarunajaya tasik malaya,aslmalikm selamat pagi pabu knapa bntuan anak mdptkn kartu nyampe atasnama arip ramdani sd tarunajaya tasik malaya,117
Ass. .wr. . ibu sy dari maluku utara saya pemegang kartu kps tapi anak saya tidak dapat bantuan dari 2013 anak saya smp. Masalah ini mau di laporkan kemana bu saya suda ke Diknas tapi sampai pergantian Presiden anak saya tidak dapat yng bantuan 2013,wr malu utara pegang kartu anak bantu anak smp suda diknas ganti presiden anak bantu,117
!KPS  35p3lm36653008..kena apa saya sekarang endak dapat beras RASKIN lagi.apa kartu ini endak laku lagi.kok endak d kasi pemberi tauan.nama  saya sukirno!.ma tembesi kampung baru .rt 06.jambi.d mana rakyatkecil minta perlidungan .saya emang rakyat biasa.,p lm kena endak beras raskin kartu endak laku endak tau sukirno ma tembesi kampung rt jambi rakyatkecil perlidungan rakyat,119
KPS. 36s5913541000.raskin tidak transparan.tebusan per kg Rp 3000.kadus/ Rt gratis.dari 2013.sampai sekarang 2014 hanya 5 kg.2015. 10 kg.dana kps / blt.banyak warga miskin di dusun kami tidak terima.orang kaya mobil 2 .kadus /Rt semua terima padahal sudah,s raskin transparan tebus kg rupiah kadus rt gratis kg kg dana blt warga miskin dusun orang kaya mobil kadus rt,119
